<?xml version='1.0' encoding='UTF-8'?>

<!--
    DTD of XML wrapper for Properties
    Typical usage:

    <?xml version="1.0"?>

    <!DOCTYPE properties SYSTEM "properties.dtd">

    <properties>
        <propertylist name="wrox">
            <property name="website">www.wrox.com</property>
            <property name="email">someone@wrox.com</property>      
        </propertylist>
            ...
    </properties>
-->

  <!ELEMENT properties (#PCDATA|propertylist)*>

  <!ELEMENT property (#PCDATA)>
  <!ATTLIST property name CDATA #IMPLIED>

  <!ELEMENT propertylist (#PCDATA|property)*>
  <!ATTLIST propertylist name CDATA #IMPLIED>
